{
  "$schema": "http://json-schema.org/draft-07/schema#",
  "$id": "https://simplyzombies.dev/schemas/loot.schema.json",
  "title": "Location loot table",
  "description": "A loot table for one location type, per docs/12-resources.md: 'A loot table declares location type, resource weights, tier weights, and quantity ranges.' A loot site names one of these by its location and SimBoot.place_loot rolls it -- whether the site came from a district's lootProfile (SimWorldgen's worldgen.sites pass) or from a template's own loot rows. Adding a location type -- a school, a marina, a police station -- is one entry here plus map tagging, with no code change. NOTE: the content validator is shallow (top-level types and unexpected top-level keys only) and does not recurse into `entries` or the range objects; check_loot.gd is the gate that does, and it is the reason a wrong key inside a nested block cannot sit here unnoticed the way one did in item.wrap.cloth's armor block.",
  "type": "object",
  "required": ["id", "name", "location", "rolls", "tierWeights", "entries"],
  "additionalProperties": false,
  "properties": {
    "id": {
      "type": "string",
      "pattern": "^loot\\.[a-z0-9_]+$",
      "description": "Stable namespaced id, always loot.<location>."
    },
    "name": { "type": "string", "description": "Human-readable location name." },
    "location": {
      "type": "string",
      "enum": ["residential", "commercial", "industrial", "medical", "military_cache"],
      "description": "The location type, matching a loot site's `table`. The enum is docs/12's five scavenging locations, kept in step by hand with map.schema.json, building.schema.json and district.schema.json; Milestone 2 authors four of them -- industrial is the slot still waiting for its table."
    },
    "danger": {
      "type": "string",
      "enum": ["low", "moderate", "high", "very_high", "extreme"],
      "description": "docs/12's risk gradient, which is the difficulty curve. Declared here so the table and its danger cannot drift apart; nothing reads it yet -- the director will."
    },
    "rolls": {
      "type": "object",
      "description": "How many picks this site yields, inclusive. Not how many items: a pick can be a stack.",
      "required": ["min", "max"],
      "additionalProperties": false,
      "properties": {
        "min": { "type": "integer", "minimum": 0 },
        "max": { "type": "integer", "minimum": 0 }
      }
    },
    "tierWeights": {
      "type": "object",
      "description": "Relative weights over the item tiers this location yields. Keys must be SimItems.TIERS ids; a location that never yields a tier simply omits it. This replaces SimItems.roll_tier for placed loot, which is how a military cache comes out better than a kitchen drawer.",
      "additionalProperties": { "type": "integer", "minimum": 0 }
    },
    "entries": {
      "type": "array",
      "minItems": 1,
      "description": "The weighted pool. Weights are relative within this table only.",
      "items": {
        "type": "object",
        "required": ["item", "weight"],
        "additionalProperties": false,
        "properties": {
          "item": { "type": "string", "pattern": "^item\\.[a-z0-9_]+(\\.[a-z0-9_]+)*$" },
          "weight": { "type": "integer", "minimum": 1 },
          "count": {
            "type": "object",
            "description": "Quantity range for a stackable base, inclusive. Omitted means exactly one. SimItems clamps to the base's own stack limit.",
            "required": ["min", "max"],
            "additionalProperties": false,
            "properties": {
              "min": { "type": "integer", "minimum": 1 },
              "max": { "type": "integer", "minimum": 1 }
            }
          }
        }
      }
    }
  }
}
