[
  {
    "id": "loot.residential",
    "name": "Residential",
    "location": "residential",
    "danger": "low",
    "rolls": {
      "min": 3,
      "max": 5
    },
    "tierWeights": {
      "scavenged": 85,
      "modified": 15
    },
    "entries": [
      {
        "item": "item.food.canned",
        "weight": 5,
        "count": {
          "min": 1,
          "max": 3
        }
      },
      {
        "item": "item.food.raw",
        "weight": 4,
        "count": {
          "min": 1,
          "max": 2
        }
      },
      {
        "item": "item.water.bottle",
        "weight": 9,
        "count": {
          "min": 1,
          "max": 2
        }
      },
      {
        "item": "item.bandage.cloth",
        "weight": 9,
        "count": {
          "min": 1,
          "max": 3
        }
      },
      {
        "item": "item.rag.dirty",
        "weight": 8,
        "count": {
          "min": 1,
          "max": 4
        }
      },
      {
        "item": "item.painkillers.blister",
        "weight": 5,
        "count": {
          "min": 1,
          "max": 2
        }
      },
      {
        "item": "item.antiseptic.bottle",
        "weight": 3
      },
      {
        "item": "item.tape.duct",
        "weight": 7,
        "count": {
          "min": 1,
          "max": 2
        }
      },
      {
        "item": "item.knife.kitchen",
        "weight": 8
      },
      {
        "item": "item.bat.aluminium",
        "weight": 5
      },
      {
        "item": "item.spear.improvised",
        "weight": 4
      },
      {
        "item": "item.axe.fire",
        "weight": 3
      },
      {
        "item": "item.candle.wax",
        "weight": 6,
        "count": {
          "min": 1,
          "max": 3
        }
      },
      {
        "item": "item.scrap.metal",
        "weight": 6,
        "count": {
          "min": 1,
          "max": 3
        }
      },
      {
        "item": "item.satchel.canvas",
        "weight": 3
      },
      {
        "item": "item.bow.hunting",
        "weight": 2
      },
      {
        "item": "item.shotgun.sawnoff",
        "weight": 2
      },
      {
        "item": "item.club.golf",
        "weight": 5
      },
      {
        "item": "item.pick.ice",
        "weight": 6
      },
      {
        "item": "item.sabre.cavalry",
        "weight": 2
      },
      {
        "item": "item.ammo.arrow",
        "weight": 2,
        "count": {
          "min": 4,
          "max": 12
        }
      },
      {
        "item": "item.ammo.arrow.target",
        "weight": 1,
        "count": {
          "min": 4,
          "max": 10
        }
      },
      {
        "item": "item.attach.wrap.leather",
        "weight": 4
      },
      {
        "item": "item.attach.head.spiked",
        "weight": 2
      },
      {
        "item": "item.cap.canvas",
        "weight": 6
      },
      {
        "item": "item.mask.cloth",
        "weight": 6
      },
      {
        "item": "item.glasses.safety",
        "weight": 4
      },
      {
        "item": "item.gloves.work",
        "weight": 6
      },
      {
        "item": "item.pants.canvas",
        "weight": 5
      },
      {
        "item": "item.boots.leather",
        "weight": 4
      },
      {
        "item": "item.whetstone",
        "weight": 5
      },
      {
        "item": "item.oil.gun",
        "weight": 4
      },
      {
        "item": "item.battery",
        "weight": 6,
        "count": {
          "min": 1,
          "max": 3
        }
      },
      {
        "item": "item.cloth.bolt",
        "weight": 6,
        "count": {
          "min": 1,
          "max": 2
        }
      },
      {
        "item": "item.hammer.claw",
        "weight": 5
      },
      {
        "item": "item.crowbar.steel",
        "weight": 3
      },
      {
        "item": "item.cleaver.butcher",
        "weight": 3
      },
      {
        "item": "item.jeans.denim",
        "weight": 5
      },
      {
        "item": "item.pack.school",
        "weight": 3
      },
      {
        "item": "item.soda.can",
        "weight": 3,
        "count": {
          "min": 1,
          "max": 2
        }
      },
      {
        "item": "item.juice.carton",
        "weight": 2
      },
      {
        "item": "item.food.crackers",
        "weight": 2,
        "count": {
          "min": 1,
          "max": 3
        }
      },
      {
        "item": "item.food.chocolate",
        "weight": 1,
        "count": {
          "min": 1,
          "max": 2
        }
      },
      {
        "item": "item.food.jerky",
        "weight": 1,
        "count": {
          "min": 1,
          "max": 2
        }
      },
      {
        "item": "item.kit.sewing",
        "weight": 3
      },
      {
        "item": "item.oil.machine",
        "weight": 3
      },
      {
        "item": "item.can.fuel",
        "weight": 2
      },
      {
        "item": "item.baton.police",
        "weight": 4
      },
      {
        "item": "item.superglue.tube",
        "weight": 5,
        "count": {
          "min": 1,
          "max": 2
        }
      },
      {
        "item": "item.food.dogfood.tin",
        "weight": 2,
        "count": {
          "min": 1,
          "max": 3
        }
      },
      {
        "item": "item.food.pickles.jar",
        "weight": 2
      },
      {
        "item": "item.coffee.instant",
        "weight": 4,
        "count": {
          "min": 1,
          "max": 2
        }
      },
      {
        "item": "item.ammo.38",
        "weight": 2,
        "count": {
          "min": 4,
          "max": 10
        }
      },
      {
        "item": "item.ammo.38.plusp",
        "weight": 1,
        "count": {
          "min": 2,
          "max": 6
        }
      },
      {
        "item": "item.part.string.standard",
        "weight": 4
      },
      {
        "item": "item.part.haft.standard",
        "weight": 5
      },
      {
        "item": "item.part.magazine.rimfire",
        "weight": 2
      },
      {
        "item": "item.ammo.45",
        "weight": 1,
        "count": {
          "min": 3,
          "max": 8
        }
      },
      {
        "item": "item.ammo.12g.bird",
        "weight": 1,
        "count": {
          "min": 3,
          "max": 8
        }
      },
      {
        "item": "item.food.beans.tin",
        "weight": 2,
        "count": {
          "min": 1,
          "max": 3
        }
      },
      {
        "item": "item.food.soup.tin",
        "weight": 2,
        "count": {
          "min": 1,
          "max": 2
        }
      },
      {
        "item": "item.food.fish.tin",
        "weight": 2,
        "count": {
          "min": 1,
          "max": 2
        }
      },
      {
        "item": "item.food.fruit.tin",
        "weight": 2
      },
      {
        "item": "item.food.babyfood.jar",
        "weight": 1,
        "count": {
          "min": 1,
          "max": 2
        }
      },
      {
        "item": "item.food.honey.jar",
        "weight": 2
      },
      {
        "item": "item.food.oats",
        "weight": 2
      },
      {
        "item": "item.food.noodles.instant",
        "weight": 2,
        "count": {
          "min": 1,
          "max": 3
        }
      },
      {
        "item": "item.food.sweets",
        "weight": 2,
        "count": {
          "min": 1,
          "max": 2
        }
      },
      {
        "item": "item.food.bread.stale",
        "weight": 2
      },
      {
        "item": "item.food.cheese.block",
        "weight": 2
      },
      {
        "item": "item.food.eggs.box",
        "weight": 2
      },
      {
        "item": "item.food.potatoes",
        "weight": 2
      },
      {
        "item": "item.food.apples",
        "weight": 1,
        "count": {
          "min": 1,
          "max": 2
        }
      },
      {
        "item": "item.food.mushrooms.foraged",
        "weight": 1
      },
      {
        "item": "item.food.stew.hot",
        "weight": 1
      },
      {
        "item": "item.drink.tea",
        "weight": 3
      },
      {
        "item": "item.drink.milk.powdered",
        "weight": 2
      },
      {
        "item": "item.drink.beer.can",
        "weight": 2,
        "count": {
          "min": 1,
          "max": 2
        }
      },
      {
        "item": "item.drink.cordial",
        "weight": 1
      },
      {
        "item": "item.antibiotics.expired",
        "weight": 2
      },
      {
        "item": "item.painkillers.strong",
        "weight": 1
      },
      {
        "item": "item.salts.rehydration",
        "weight": 2,
        "count": {
          "min": 1,
          "max": 2
        }
      },
      {
        "item": "item.tablets.antinausea",
        "weight": 1
      },
      {
        "item": "item.wrap.elastic",
        "weight": 2
      },
      {
        "item": "item.mask.dust",
        "weight": 4
      },
      {
        "item": "item.wood.salvaged",
        "weight": 4,
        "count": {
          "min": 1,
          "max": 3
        }
      },
      {
        "item": "item.plank.pallet",
        "weight": 3,
        "count": {
          "min": 1,
          "max": 2
        }
      },
      {
        "item": "item.fiber.plant",
        "weight": 3,
        "count": {
          "min": 1,
          "max": 3
        }
      },
      {
        "item": "item.cordage.twine",
        "weight": 3,
        "count": {
          "min": 1,
          "max": 2
        }
      },
      {
        "item": "item.fixings.nails",
        "weight": 4,
        "count": {
          "min": 2,
          "max": 6
        }
      },
      {
        "item": "item.wire.copper",
        "weight": 3,
        "count": {
          "min": 1,
          "max": 2
        }
      },
      {
        "item": "item.clay.brick",
        "weight": 2,
        "count": {
          "min": 1,
          "max": 2
        }
      },
      {
        "item": "item.coat.winter",
        "weight": 5
      },
      {